Founder journey,Simple path,Related content/tools,Priority,Notes
I have an idea but no product,Idea -> customer interviews -> problem ranking -> smoke test -> MVP experiment,Idea & Validation; MVP templates; Market Research,High,Keep this as the first practical journey.
I want to test demand,Hypothesis -> landing page / Facebook post -> interviews -> preorders / waitlist -> decision,Customer interview script; Landing page template; Facebook ad test planner,High,Include Bangla and English scripts.
I want to start an online business,Business model -> trade license -> e-TIN -> payment setup -> courier setup -> launch checklist,Trade License; e-TIN; VAT/BIN; Payments; Digital Commerce Policy,High,Blend legal and practical commerce steps.
I want to register a private limited company,Structure decision -> name clearance -> MoA/AoA -> RJSC registration -> tax/VAT -> bank account -> annual compliance,RJSC guide; Business bank account; Compliance tracker,High,Use official RJSC/NBR references.
I want to launch a SaaS from Bangladesh,Market selection -> company setup -> payments/FX -> hosting/tools -> export/SaaS tax questions -> acquisition,SaaS metrics; Export-oriented SaaS; Bangladesh Bank FX; BASIS,High,Important for diaspora and export-oriented founders.
I want to sell to SMEs,ICP -> trust-building offer -> sales script -> pilot -> onboarding -> retention dashboard,SME sales; B2B scripts; Metrics,High,Address low digitization and owner-led decisions.
I want to accept digital payments,Business model -> bank account -> gateway/wallet selection -> integration -> settlement/reconciliation -> compliance,Payment gateway basics; bKash/Nagad; Bangladesh Bank rules,High,Include mobile wallet behavior and card limits.
I want to import products,Product category -> IRC -> customs/trade portal procedure -> supplier payment -> logistics -> VAT/tax,Import/export basics; Bangladesh Trade Portal; CCIE,Medium,Needs official process citations.
I want to hire my first employee,Role scorecard -> employee vs intern/freelancer -> contract -> payroll/benefits -> onboarding,Hiring; Labor law basics; Hiring scorecard,High,Include practical salary benchmark research plan.
I want to raise angel/VC funding,Metrics -> pitch deck -> investor CRM -> data room -> outreach -> term sheet -> board setup,Funding; Pitch deck; Investor CRM; Data room,High,Include Bangladesh investor scarcity and expectations.
I want to apply to Startup Bangladesh or an accelerator,Eligibility -> program research -> application assets -> pitch -> follow-up -> reporting,Startup Bangladesh; iDEA; BIG; Accelerators,Medium,Tie into opportunities calendar.
I am a diaspora founder and want to build in Bangladesh,Market thesis -> local operator/cofounder -> company/FDI setup -> banking/FX -> hiring -> trust/distribution,Diaspora founder guide; FDI; FX; Local market playbooks,High,Treat as a dedicated user journey.
